新頭殼newtalk,101661,2018-04-27 09:02:31 SGT,Link,12,1,0,0,7,0,1,1,0,,0,0,0,https://www.facebook.com/Newtalk.Page/posts/2017352974960757,唉！一世英名！,https://newtalk.tw/news/view/2018-04-27/122388,,爆料酸頭殼,影集「天才老爹」曾是大家歡樂的記憶啊！,,,22.0
新頭殼newtalk,101657,2018-04-26 18:21:43 SGT,Link,21,0,0,0,1,0,0,0,0,,0,0,0,https://www.facebook.com/Newtalk.Page/posts/2016614578367930,陳郁秀談到華視未來走向，表示未來公視與華視將攜手合作，也將合作拍攝電視電影，希望能讓世界看見台灣影視產業的精彩。,https://newtalk.tw/news/view/2018-04-26/122348,,新團隊上陣 公視、華視合作 跨國合拍電視電影 | 藝文 | 新頭殼 Newtalk,華視3月間遴選出新任總經理莊豐嘉，4月並確定由劉俊麟、王育麟擔任副總，今（26日）在公視集團董事長陳郁秀的帶領之下，舉辦新任領導團隊的見面會。陳郁秀談到華視未來走向，表示未來公視與華視將攜手合作，也將合作.....,,,22.0
新頭殼newtalk,101657,2018-04-26 13:00:02 SGT,Link,11,6,0,0,0,4,0,1,0,,0,0,0,https://www.facebook.com/Newtalk.Page/posts/2016399438389444,警政署長陳家欽今天上午到立法院慰問受傷同仁，一一對員警發紅包、加油打氣，並感謝他們這幾天的辛勞。,https://newtalk.tw/news/view/2018-04-26/122288,,警員面對陳抗站在第一線！警政署長發紅包加油打氣 | 政治 | 新頭殼 Newtalk,反年改團體「八百壯士」25在立法院外抗議，不僅出動鐵鍊要硬拆立法院的大門，甚至攻擊警察與媒體，造成多人掛彩，警政署長陳家欽今(26)天上午也到立法院慰問受傷同仁，一一對員警發紅包、加油打氣，並感謝他們這幾天的...,,,22.0
新頭殼newtalk,101661,2018-04-27 19:50:05 SGT,Link,20,0,1,0,0,0,0,0,0,,0,0,0,https://www.facebook.com/Newtalk.Page/posts/2017805708248817,堅持國機國造政策 蔡英文：未來會有超過2千人投入,https://newtalk.tw/news/view/2018-04-27/122487,,堅持國機國造政策 蔡英文：未來會有超過2千人投入 | 政治 | 新頭殼 Newtalk,蔡英文總統今（27）日下午參訪晟田科技公司及漢翔公司，她特別表示，我國的航太產業在國機國造政策的拉引下，已經走向一個更高級、更智慧化的生產進程，相信未來在國機國造或航太產業上的發展都有很大的空間。蔡英文....,,,21.0
新頭殼newtalk,101661,2018-04-27 12:20:18 SGT,Link,16,1,0,0,0,3,0,0,0,,0,0,0,https://www.facebook.com/Newtalk.Page/posts/2017497744946280,隨扈跑起來XD！,https://newtalk.tw/news/view/2018-04-27/122414,,菁英防護！ 金正恩轎車人牆護送 | 國際 | 新頭殼 Newtalk,全球關注的文金會今 (27) 日在北緯38度板門店的和平之家舉行，南韓總統文在寅與北韓領導人金正恩上午展開閉門會議，在上午11點暫告一段落，金正恩搭車返回板門閣用餐。值得注意的是，金正恩搭車時，一群北韓菁英保鑣包.....,,,20.0
新頭殼newtalk,101657,2018-04-26 22:20:04 SGT,Link,19,0,0,0,0,1,0,0,0,,0,0,0,https://www.facebook.com/Newtalk.Page/posts/2016823385013716,國民黨杯葛軍改審查 柯建銘：不可能退卻,https://newtalk.tw/news/view/2018-04-26/122380,,國民黨杯葛軍改審查 柯建銘：不可能退卻 | 政治 | 新頭殼 Newtalk,立法院外交及國防委員會針對軍人年改草案進行詢答，最後被國民黨團成功杯葛，民進黨召委王定宇宣布散會。對此，民進黨團柯建銘晚間表示，願用今天退讓換來將來程序順利，「估計橫豎會在5月7日進行逐條審查」，他呼籲....,,,20.0
新頭殼newtalk,101661,2018-04-27 16:48:15 SGT,Link,7,0,0,0,0,12,0,0,0,,0,0,0,https://www.facebook.com/Newtalk.Page/posts/2017668691595852,被關起來的前任南韓總統們也看得到哦XD - - - - - 💡新頭殼LINE@生活圈：https://goo.gl/fEros4:=:https://line.me/R/ti/p/@boq3291t,https://newtalk.tw/news/view/2018-04-27/122443,,朴槿惠和李明博也能看！韓國法務部指示監獄直播文金會 | 國際 | 新頭殼 Newtalk,眾所矚目的兩峰腦會今在板門店舉行，韓媒報導，韓國法務部指示全國監獄直播這場兩位領導人的會面。換句話說，目前被羈押在首爾拘留所的朴槿惠和首爾東部拘留所的李明博兩位前總統，也可以感受這一歷史時刻。不過，尚...,,,19.0
新頭殼newtalk,101661,2018-04-27 14:40:04 SGT,Link,17,1,1,0,0,0,0,0,0,,0,0,0,https://www.facebook.com/Newtalk.Page/posts/2017589298270458,基隆輕軌採雙軌化 林右昌：基隆到南港僅需25分鐘,https://newtalk.tw/news/view/2018-04-27/122437,,基隆輕軌採雙軌化 林右昌：基隆到南港僅需25分鐘 | 政治 | 新頭殼 Newtalk,基隆市長林右昌近日赴市議會進行施政總報告，除了細數執政3年來多項政績，也對於市民關注的基隆輕軌建設做出進一步說明，交通部鐵路改建工程局將朝全面將採全面雙軌化，每小時最高可達12班次，預計基隆到南港僅需25.5.....,,,19.0
新頭殼newtalk,101657,2018-04-27 08:00:04 SGT,Link,17,0,0,0,0,2,0,0,0,,0,0,0,https://www.facebook.com/Newtalk.Page/posts/2017311258298262,任命案過關 美新國務卿蓬佩奧亮相合影金正恩,https://newtalk.tw/news/view/2018-04-27/122385,,任命案過關 美新國務卿蓬佩奧亮相合影金正恩 | 國際 | 新頭殼 Newtalk,57對42票，民主黨議員阻止無效，美國參議院在韓國與朝鮮文金會前夕，通過中情局局長蓬佩奧（Mike Pompeo）的國務卿任命案，出身軍旅的蓬佩奧對中國的立場強硬，而白宮也趁機發布蓬佩奧與朝鮮領導人金正恩的在復活節會面合...,,,19.0
新頭殼newtalk,101661,2018-04-27 15:50:04 SGT,Link,12,1,3,2,0,0,0,0,0,,0,0,0,https://www.facebook.com/Newtalk.Page/posts/2017632184932836,醫療暴力年年增 時力議員參選人：零容忍,https://newtalk.tw/news/view/2018-04-27/122449,,醫療暴力年年增 時力議員參選人：零容忍 | 政治 | 新頭殼 Newtalk,三名由時代力量提名且有醫療背景的台中市及高雄市議員參選人，今（27）日在時代力量台中黨部舉行記者會，要求衛生局等相關單位要重視醫療暴力案件逐年增加的問題，除了要重視通報機制外，要更多向民眾宣導。台中市南....,,,18.0
新頭殼newtalk,101661,2018-04-27 08:48:26 SGT,Link,17,0,1,0,0,0,0,0,0,,0,0,0,https://www.facebook.com/Newtalk.Page/posts/2017341621628559,歷史性文金會，讓板門店的紀錄再添一筆！,https://newtalk.tw/news/view/2018-04-27/122056,,兩韓峰會地點 板門店大解密！ | 國際 | 新頭殼 Newtalk,南韓總統文在寅和北韓領導人金正恩將在本週五（27）於板門店召開兩韓史上第三次高峰會！兩韓領袖將於板門店南韓一側的「和平之家」會面，被視為北韓釋出的善意。自從1953年兩韓於板門店簽訂《朝鮮停戰協定》開始，這裡...,,,18.0
新頭殼newtalk,101657,2018-04-26 18:20:03 SGT,Link,9,4,0,0,1,1,0,3,0,,0,0,0,https://www.facebook.com/Newtalk.Page/posts/2016613651701356,張善政指南市二百億未處理土壤液化 市府駁斥,https://newtalk.tw/news/view/2018-04-26/122342,,張善政指南市二百億未處理土壤液化 市府駁斥 | 政治 | 新頭殼 Newtalk,有意參選台南市長的前政務委員高思博昨（25）日拜會前行政院長張善政，張善政對於台南市府在收到中央200億元工程款解決土壤液化問題，卻遲遲未有動作，置市民居住安全於不顧的做法十分不滿，認同台南市長一定要換人做....,,,18.0
新頭殼newtalk,101657,2018-04-26 14:40:02 SGT,Link,12,0,2,0,3,0,0,1,0,,0,0,0,https://www.facebook.com/Newtalk.Page/posts/2016473185048736,Android手機用戶注意！ 新一波間諜程式攻擊現身,https://newtalk.tw/news/view/2018-04-26/122304,,Android手機用戶注意！ 新一波間諜程式攻擊現身 | 科技 | 新頭殼 Newtalk,安卓手機用戶注意！有資安廠商近期偵測到一波新網路攻擊，Android惡意程式「ANDROIDOS_XLOADER.HRX」會透過入侵路由器篡改網域名稱系統設定（DNS）進行散播，推播假冒的通知訊息引誘受害者去惡意網域下載 XLoader惡意程式，並喬裝...,,,18.0
新頭殼newtalk,101657,2018-04-26 08:21:08 SGT,Link,10,0,0,1,4,1,0,2,0,,0,0,0,https://www.facebook.com/Newtalk.Page/posts/2016184808410907,韓媒：6朝鮮人因向中國出售機密電話簿 以叛國罪槍決,https://newtalk.tw/news/view/2018-04-26/122252,,韓媒：6朝鮮人因向中國出售機密電話簿 以叛國罪槍決 | 國際 | 新頭殼 Newtalk,韓國媒體報導，去年年底6名平壤人因將含有機密的電話簿賣到中國賺錢，被以叛國罪槍決。他們的家人都被逐出首都，流放到黃海省。根據朝鮮脫北者在首爾經營的「每日北韓」（Daily NK）新聞網昨（25）日的說法，朝鮮的電話....,,,18.0
新頭殼newtalk,101661,2018-04-27 15:10:05 SGT,Link,9,1,0,0,1,6,0,0,0,,0,0,0,https://www.facebook.com/Newtalk.Page/posts/2017607874935267,華為遭美調查 台灣半導體遭衝擊 5G時程受影響,https://newtalk.tw/news/view/2018-04-27/122441,,華為遭美調查 台灣半導體遭衝擊 5G時程受影響 | 財經 | 新頭殼 Newtalk,美國商務部調查中國大陸業者違反美國對伊朗與北韓制裁協議的火苗，市場傳出燒到華為，投顧業者分析，主要影響5G交換機時程，但會刺激中國大陸加速發展自家晶片。華為是全球網通設備龍頭暨全球第3大智慧手機廠，與大立...,,,17.0
新頭殼newtalk,101657,2018-04-27 07:50:04 SGT,Link,14,0,1,0,2,0,0,0,0,,0,0,0,https://www.facebook.com/Newtalk.Page/posts/2017304111632310,行賄朴槿惠！韓國前後3任情報頭子 被檢方求刑,https://newtalk.tw/news/view/2018-04-27/122383,,行賄朴槿惠！韓國前後3任情報頭子 被檢方求刑 | 國際 | 新頭殼 Newtalk,韓聯社報導，首爾中央地方法院昨（26）日對涉嫌向前總統朴槿惠行賄的前國家情報院院長南在俊進行最後一次審理，韓國檢方提請法院判處南在俊有期徒刑7年。報導稱，韓國檢方還提請法院分別判處同樣涉嫌向朴槿惠總統府上...,,,17.0
新頭殼newtalk,101657,2018-04-26 16:40:03 SGT,Link,12,0,0,0,0,4,0,0,0,,0,0,0,https://www.facebook.com/Newtalk.Page/posts/2016548275041227,大陸籍男子周泓旭，涉嫌吸收一名外交人士未遂，高院今天依國家安全法判處周1年2月徒刑，並認為周有逃亡之虞，裁定延長羈押2個月，但解除禁止接見通信。,https://newtalk.tw/news/view/2018-04-26/122339,,有逃亡之虞 共諜案周泓旭延押2個月 | 司法 | 新頭殼 Newtalk,大陸籍男子周泓旭，涉嫌吸收一名外交人士未遂，高院今天依國家安全法判處周1年2月徒刑，並認為周有逃亡之虞，裁定延長羈押2個月，但解除禁止接見通信。台灣高等法院指出，周泓旭民國106年3月9日遭調查局約談時人身自由....,,,16.0
新頭殼newtalk,101661,2018-04-27 12:30:04 SGT,Link,11,1,0,0,0,1,0,2,0,,0,0,0,https://www.facebook.com/Newtalk.Page/posts/2017504721612249,檢察總長同意權投票 江惠民高票過關,https://newtalk.tw/news/view/2018-04-27/122411,,檢察總長同意權投票 江惠民高票過關 | 政治 | 新頭殼 Newtalk,立法院院會今天（27日）行使檢察總長人事同意權投票，檢察總長被提名人、高等法院台中分院檢察署檢察長江惠民總計獲84同意票，1人投不同意，2無效票，獲立院同意任檢察總長，任期4年。現任最高法院檢察署檢察總長顏大.....,,,15.0
新頭殼newtalk,101657,2018-04-26 18:50:04 SGT,Link,13,0,2,0,0,0,0,0,0,,0,0,0,https://www.facebook.com/Newtalk.Page/posts/2016635951699126,內政部修正「因公殉職」定義 給予警察遺族妥善照顧,https://newtalk.tw/news/view/2018-04-26/122347,,內政部修正「因公殉職」定義 給予警察遺族妥善照顧 | 政治 | 新頭殼 Newtalk,基層警消工作性質特殊深具危勞性，為契合勤務高危險的特性，內政部今（26）日部務會報通過「警察人員人事條例施行細則」第17條修正草案，這次修正「因公殉職」定義，希望能使處理對生命有高度危險事故，遭受暴力或意.....,,,15.0
新頭殼newtalk,101657,2018-04-26 16:02:52 SGT,Link,13,1,0,0,1,0,0,0,0,,0,0,0,https://www.facebook.com/Newtalk.Page/posts/2016523468377041,兩韓「文金會」，就在明天！😯,https://newtalk.tw/news/view/2018-04-26/122299,,「統一麵」來了！南韓演練「跨境上菜」至「和平之家」 | 國際 | 新頭殼 Newtalk,據韓媒報導，為迎接明天早上登場的「文金會」，南韓方面今(26)日下午2點，將繼續進行南韓總統文在寅的6名會談隨行人員全部參加的總排練。據韓聯社報導，韓朝雙方工作人員昨（25）日已在板門店進行兩韓領袖會晤排練。此....,,,15.0
新頭殼newtalk,101657,2018-04-26 09:40:02 SGT,Link,12,2,0,0,0,1,0,0,0,,0,0,0,https://www.facebook.com/Newtalk.Page/posts/2016245741738147,反年改濺血 林佳龍：民主非暴力的藉口,https://newtalk.tw/news/view/2018-04-26/122262,,反年改濺血 林佳龍：民主非暴力的藉口 | 政治 | 新頭殼 Newtalk,立法院周邊26日因反年金改革抗議行動，爆發嚴重流血衝突事件，有多位媒體記者、警察受傷，台中市長林佳龍昨晚也在臉書表示關切，呼籲權利的爭取必須回歸理性對話，絕不是暴力攻擊。林佳龍在臉書表示，昨日的衝突事件....,,,15.0
新頭殼newtalk,101661,2018-04-27 14:38:13 SGT,Link,10,2,0,0,0,1,0,0,0,,0,0,0,https://www.facebook.com/Newtalk.Page/posts/2017586938270694,金小胖訪青瓦台可能也不遠了？,https://newtalk.tw/news/view/2018-04-27/122404,,金正恩：只要文在寅邀請 隨時願意走訪青瓦台 | 國際 | 新頭殼 Newtalk,兩韓峰會開啟北韓領導人金正恩的外交行腳，根據法新社的報導，繼今天與南韓總統文在寅在板門店會談後，未來，只要文在寅邀請，他隨時願意訪問首爾，到青瓦台（總統府）走走。法新社引述文在寅發言人的說法稱，雙方領...,,,13.0
新頭殼newtalk,101661,2018-04-27 12:50:05 SGT,Link,8,3,1,0,1,0,0,0,0,,0,0,0,https://www.facebook.com/Newtalk.Page/posts/2017519004944154,「關說兵役」邱昱凱幫打選戰？柯P：也許會吧,https://newtalk.tw/news/view/2018-04-27/122413,,「關說兵役」邱昱凱幫打選戰？柯P：也許會吧 | 政治 | 新頭殼 Newtalk,作家吳祥輝昨在臉書分享一名網友爆料，曾涉及關說兵役而請辭的前北市府市長室專員「小凱」邱昱凱，是目前主要幫台北市長柯文哲主導選戰、在PTT帶風向的人，而且柯P每週都會有固定一天和選戰團隊「旱草聯盟」成員開會.....,,,13.0
新頭殼newtalk,101661,2018-04-27 11:50:04 SGT,Link,12,1,0,0,0,0,0,0,0,,0,0,0,https://www.facebook.com/Newtalk.Page/posts/2017475834948471,時力嘉義市議員參選人張志翔：站上肥皂箱 打破議會黑箱,https://newtalk.tw/news/view/2018-04-27/122412,,時力嘉義市議員參選人張志翔：站上肥皂箱 打破議會黑箱 | 政治 | 新頭殼 Newtalk,第三勢力政黨「時代力量」提名嘉義大學畢業的張志翔參選嘉義市東區市議員，他是時力在嘉義地區唯一的議員提名人，政見主軸包含提升勞動權益與議會透明化，今年30歲的張志翔呼籲嘉義年輕人不要再對政治冷漠，唯有投身....,,,13.0
新頭殼newtalk,101661,2018-04-27 12:23:50 SGT,Live Video Complete,8,2,2,1,0,0,0,0,0,original,546,566,0,https://www.facebook.com/Newtalk.Page/posts/2017460198283368,#新頭殼午間直播 又是一個星期五～！ 首先帶大家今日的國際大事文金會！ 而本周天氣、空品如何，主播秝榕連線氣象局告訴你～😉 時間即將進入五月，大家是不是也想知道梅雨季何時來呢？ 直播也將帶大家了解麻疹疫情目前發展如何，千萬別錯過囉！ 而大家最關心的周末去哪玩，本周替大家整理了野餐懶人包 假日就到大草原上放鬆身心吧～～～😍,https://www.facebook.com/Newtalk.Page/videos/2017460198283368/,,新頭殼午間直播》梅雨季將來臨？周末一起野餐趣！,,,,13.0
新頭殼newtalk,101657,2018-04-26 19:40:02 SGT,Link,11,1,0,0,0,0,0,1,0,,0,0,0,https://www.facebook.com/Newtalk.Page/posts/2016674865028568,陳其邁率團往歐洲考察 盼高雄實現工業4.0,https://newtalk.tw/news/view/2018-04-26/122364,,陳其邁率團往歐洲考察 盼高雄實現工業4.0 | 政治 | 新頭殼 Newtalk,高雄市長參選人陳其邁在初選期間提出「智慧城市、經濟首都」的願景，現率團前往歐洲進行為期一個星期的城市考察。行程主要目的是觀察歐洲最新的產業趨勢與智慧城市典範，以及水岸改造的案例，希望考察成果能作為高雄...,,,13.0
新頭殼newtalk,101657,2018-04-26 14:20:02 SGT,Link,9,1,0,0,0,3,0,0,0,,0,0,0,https://www.facebook.com/Newtalk.Page/posts/2016459095050145,太猛了! 強國大學運動會扔手榴彈 報名瞬間額滿,https://newtalk.tw/news/view/2018-04-26/122308,,太猛了! 強國大學運動會扔手榴彈 報名瞬間額滿 | 中國 | 新頭殼 Newtalk,位於中國山西省太原市的中北大學，往年所舉辦的運動會很少受到重視，報名人數也不多。今年校方特別增加了「擲手榴彈｣的比賽項目，一時為之轟動，報名瞬間額滿。中北大學體育學院主任李江霞表示，由於往年報名擲標槍...,,,13.0
新頭殼newtalk,101661,2018-04-27 19:40:05 SGT,Link,8,2,0,0,1,1,0,0,0,,0,0,0,https://www.facebook.com/Newtalk.Page/posts/2017797714916283,南韓人緊盯電視歷史性一刻 北韓只見測試畫面,https://newtalk.tw/news/view/2018-04-27/122484,,南韓人緊盯電視歷史性一刻 北韓只見測試畫面 | 國際 | 新頭殼 Newtalk,兩韓領袖今天舉行11年來首場高峰會，幾乎每家南韓電視台都鋪天蓋地報導。兩人在板門店軍事分界線握手時，許多南韓民眾緊盯螢幕觀看歷史性的一刻。北韓民眾則看不到任何畫面。法新社報導，根據南韓司法部的聲明，甚至....,,,12.0
新頭殼newtalk,101661,2018-04-27 16:50:05 SGT,Link,7,2,1,0,1,1,0,0,0,,0,0,0,https://www.facebook.com/Newtalk.Page/posts/2017669854929069,前中國國台辦主任張志軍 出任海協會會長,https://newtalk.tw/news/view/2018-04-27/122460,,前中國國台辦主任張志軍 出任海協會會長 | 中國 | 新頭殼 Newtalk,前中國國台辦主任、現任中國全國人大外事委員會副主任張志軍今天被推舉為大陸海協會新一任會長。中國國務院台灣事務辦公室旗下的中國台灣網報導，中國大陸海峽兩岸關係協會27日上午在北京召開第4屆理事會第一次會議，...,,,12.0
新頭殼newtalk,101661,2018-04-27 16:10:04 SGT,Link,11,1,0,0,0,0,0,0,0,,0,0,0,https://www.facebook.com/Newtalk.Page/posts/2017646981598023,陳其邁訪歐取經 高雄要成立「發展基金」助產業升級,https://newtalk.tw/news/view/2018-04-27/122452,,陳其邁訪歐取經 高雄要成立「發展基金」助產業升級 | 政治 | 新頭殼 Newtalk,立委陳其邁昨日到訪工業4.0的起源地德國，並前往具全球工業指標性意義的漢諾威工業展，有來自世界各地指標性的產業及廠商，展示其對於工業4.0及智慧製造的創新發展。陳其邁表示，工業4.0已是全球趨勢，透過參訪期望能將...,,,12.0
新頭殼newtalk,101657,2018-04-26 20:50:04 SGT,Link,12,0,0,0,0,0,0,0,0,,0,0,0,https://www.facebook.com/Newtalk.Page/posts/2016740988355289,德國預估美國5月開徵鋼鋁稅,https://newtalk.tw/news/view/2018-04-26/122372,,德國預估美國5月開徵鋼鋁稅 | 國際 | 新頭殼 Newtalk,德國總理梅克爾（Angela Merkel）準備前往美國之際，德國政府一名消息人士今天表示，德國預料美國將從5月1日起，針對來自歐盟的鋼鋁課徵懲罰性關稅。美國總統川普和梅克爾在華盛頓舉行會談前夕，這名德國政府消息人士表示...,,,12.0
新頭殼newtalk,101657,2018-04-26 19:00:04 SGT,Link,7,0,1,0,0,0,0,4,0,,0,0,0,https://www.facebook.com/Newtalk.Page/posts/2016643538365034,吳謙證實蘇-35參與繞島訓練 東風-26導彈加入火箭部隊,https://newtalk.tw/news/view/2018-04-26/122353,,吳謙證實蘇-35參與繞島訓練 東風-26導彈加入火箭部隊 | 政治 | 新頭殼 Newtalk,對岸解放軍動作頻頻，從大小軍演到繞島巡航，並不斷提升軍備實力，對台震懾壓力劇增。中國國防部新聞局局長、國防部新聞發言人吳謙大校今（26）日在例行記者會上證實，蘇-35等多型多架戰機參加繞島訓練，意味著蘇-35戰....,,,12.0
新頭殼newtalk,101661,2018-04-27 19:30:05 SGT,Link,10,1,0,0,0,0,0,0,0,,0,0,0,https://www.facebook.com/Newtalk.Page/posts/2017789901583731,文在寅對金與正說了什麼話 害她臉紅了？……,https://newtalk.tw/news/view/2018-04-27/122482,,文在寅對金與正說了什麼話 害她臉紅了？…… | 國際 | 新頭殼 Newtalk,南韓總統文在寅趁開會之便，藉機「虧妹」！？韓聯社報導，韓國總統府青瓦臺負責與民溝通的首席祕書尹永燦今天在記者會上大爆「老闆」文在寅的料。尹永燦說，今天早上，兩韓峰會正式會談開始前，文在寅總統當面對朝鮮...,,,11.0
新頭殼newtalk,101661,2018-04-27 10:10:04 SGT,Link,11,0,0,0,0,0,0,0,0,,0,0,0,https://www.facebook.com/Newtalk.Page/posts/2017402801622441,文金峰會圖集搶先看！,https://newtalk.tw/news/view/2018-04-27/122393,,文金峰會歷史性的一刻！他們在做什麼？(圖集) | 國際 | 新頭殼 Newtalk,文金會今日登場，最新狀況持續更新！09:35金正恩在會上向文在寅說：我徒步200公尺跨越南方，其實很容易，兩韓並沒有阻礙，話雖如此，我們還是花了11年才走到這一刻。很多人期待這一天到來。文在寅則說，當他跨過分界線.....,,,11.0
新頭殼newtalk,101661,2018-04-27 11:40:06 SGT,Link,10,0,0,0,0,0,0,0,0,,0,0,0,https://www.facebook.com/Newtalk.Page/posts/2017468491615872,擔任蘇的競總主委？ 陳菊：支持蘇貞昌、做好總統幕僚長,https://newtalk.tw/news/view/2018-04-27/122407,,擔任蘇的競總主委？ 陳菊：支持蘇貞昌、做好總統幕僚長 | 政治 | 新頭殼 Newtalk,總統府秘書長陳菊今（27）日早上首度赴立法院拜會民進黨團，被問及是否接任新北市長參選人蘇貞昌的競選總部主委？陳菊語帶保留地說，支持蘇貞昌，但現階段要扮演好輔佐總統的幕僚長角色。陳菊上任總統府秘書長之後，....,,,10.0
新頭殼newtalk,101657,2018-04-26 14:00:03 SGT,Link,10,0,0,0,0,0,0,0,0,,0,0,0,https://www.facebook.com/Newtalk.Page/posts/2016445208384867,前法官胡景彬收賄判16年定讞 情婦扮白手套判12年,https://newtalk.tw/news/view/2018-04-26/122306,,前法官胡景彬收賄判16年定讞 情婦扮白手套判12年 | 司法 | 新頭殼 Newtalk,台中高分院前法官胡景彬被指控藉審理民事案件，透過同居人黃姓婦人收賄。最高法院今天依收賄罪判處胡景彬16年徒刑、罰金600萬元，黃婦12年徒刑、罰金400萬元定讞。特偵組偵辦此案查出胡景彬不明來源財產共有新台幣4691萬....,,,10.0
新頭殼newtalk,101661,2018-04-27 11:10:05 SGT,Link,9,0,0,0,0,0,0,0,0,,0,0,0,https://www.facebook.com/Newtalk.Page/posts/2017448404951214,執任將滿兩周年 蔡英文今展開「5 2產業創新系列行程」,https://newtalk.tw/news/view/2018-04-27/122405,,執任將滿兩周年 蔡英文今展開「5 2產業創新系列行程」 | 政治 | 新頭殼 Newtalk,民進黨政府執任即將滿兩周年，蔡英文總統今（27）天南下台南、高雄，啟動兩天一夜的「5 2產業創新系列行程」，參訪亞洲航空公司、晟田工業公司、漢翔航空工業公司等。對此，總統府發言人黃重諺表示，希望透過該行程，....,,,9.0
新頭殼newtalk,101657,2018-04-26 16:12:57 SGT,Link,9,0,0,0,0,0,0,0,0,,0,0,0,https://www.facebook.com/Newtalk.Page/posts/2016529501709771,107年全國大專院校運動會（全大運）今日開打！電子競技運動更首次被列入全大運比賽項目！,https://newtalk.tw/news/view/2018-04-26/122323,,電競潮頭殼,電競成為今年度 #全大運 的示範項目！大哥也來啦～～～！,,,9.0
新頭殼newtalk,101661,2018-04-27 12:00:05 SGT,Link,5,1,0,0,0,2,0,0,0,,0,0,0,https://www.facebook.com/Newtalk.Page/posts/2017483574947697,中國計劃2020年開始在太空組建一個空間站，預計該空間站到2022年建成並運營。中國人住在月宮的夢想，或許會在不久的將來成真。,https://newtalk.tw/news/view/2018-04-27/122410,,嫦娥當鄰居！北京擬建有人月球基地 外媒：中國版阿波羅計劃 | 科技 | 新頭殼 Newtalk,根據外媒報導，北京在這星期啟動了新一輪的「太空人」選拔。這次將選拔17-18名宇航員，候選人包括人民解放軍空軍飛行員、工程師及實驗任務專家，女性申請者也將被接受。中國計劃2020年開始在太空組建一個空間站，預計該...,,,8.0
新頭殼newtalk,101661,2018-04-27 11:44:18 SGT,Link,6,0,0,0,1,0,1,0,0,,0,0,0,https://www.facebook.com/Newtalk.Page/posts/2017472134948841,台中的朋友注意啦～～趕緊儲水！！,https://newtalk.tw/news/view/2018-04-27/122408,,生活Fun頭殼,台水公司第四區處今 (27) 日表示，5月5日上午10時起至5月7日上午3時止停水，進行「五合一工程｣施作。,,,8.0
