新頭殼newtalk,101657,2018-04-26 15:30:03 SGT,Link,49,2,1,1,2,5,0,0,0,,0,0,0,https://www.facebook.com/Newtalk.Page/posts/2016502868379101,有沒有獵豬的高手XD你的舞台來了！,https://newtalk.tw/news/view/2018-04-26/122324,,大豬6千元乳豬1千元 蘭嶼找獵野豬高手 | 生活 | 新頭殼 Newtalk,蘭嶼脫逃野豬為患，鄉公所貼公告捉野豬，大豬獎勵金新台幣6000元，乳豬1000元。獵捕上千頭山豬的布農族山豬王吉呀努，希望跨海為民除害。蘭嶼鄉公所最近貼出公告，山林野豬捕捉獎勵辦法，凡是雅美族身分者，捕捉山林野....,,,60.0
新頭殼newtalk,101661,2018-04-27 21:40:05 SGT,Link,44,4,1,7,0,0,0,3,0,,0,0,0,https://www.facebook.com/Newtalk.Page/posts/2017905521572169,卡管事件簿最終章》教部兩張聲明稿 台大校長重新選,https://newtalk.tw/news/view/2018-04-27/122497,,卡管事件簿最終章》教部兩張聲明稿 台大校長重新選 | 政治 | 新頭殼 Newtalk,歷時3個月的審核，還換掉一個教育部長，台大校長當選人管中閔的聘任案今（27）晚總算有結果，教育部次長林騰蛟表示，台大校長遴選有重大利益未迴避的適法疑慮，無法接受遴選結果，宣布駁回台灣大學講座教授管中閔的台...,,,59.0
新頭殼newtalk,101661,2018-04-27 21:30:05 SGT,Link,28,0,7,0,1,0,16,7,0,,0,0,0,https://www.facebook.com/Newtalk.Page/posts/2017896154906439,余杰觀點》 是中國“新的疆土”，還是維族的集中營？,https://newtalk.tw/news/view/2018-04-27/122496,,余杰觀點》 是中國“新的疆土”，還是維族的集中營？ | 中國 | 新頭殼 Newtalk,「維吾爾族」是東突厥斯坦的主體民族，世世代代居住在天山南北麓地區。他們的祖先曾經馳騁在廣漠的中亞草原與荒漠，在涵蓋了東突厥斯坦這塊土地在內的蒙古大草原和中亞地區，建立了匈奴帝國、突厥帝國、回鶻帝國、喀...,,,59.0
新頭殼newtalk,101661,2018-04-27 17:50:05 SGT,Link,50,6,2,0,0,0,0,0,0,,0,0,0,https://www.facebook.com/Newtalk.Page/posts/2017712108258177,兩韓之後，一定有人問那兩岸呢？🤔,https://newtalk.tw/news/view/2018-04-27/122467,,兩韓將停止敵對 蔡英文：沒設政治前提且對等 樂見對岸領導人 | 政治 | 新頭殼 Newtalk,兩韓峰會今（27）日登場，南韓總統文在寅與北韓領導者金正恩下午簽署共同宣言，商定停止一切敵對行為，共同爭取在年內宣布結束戰爭狀態。對此，蔡英文總統下午在高雄參訪漢翔航空工業後受訪表示，只要沒設政治前提且....,,,58.0
新頭殼newtalk,101657,2018-04-26 19:10:03 SGT,Link,9,6,2,0,1,17,0,16,0,,0,0,0,https://www.facebook.com/Newtalk.Page/posts/2016652498364138,馬克宏：見達賴喇嘛會引發法中危機,https://newtalk.tw/news/view/2018-04-26/122361,,馬克宏：見達賴喇嘛會引發法中危機 | 國際 | 新頭殼 Newtalk,法國總統馬克宏（Emmanuel Macron）今天否決會見西藏精神領袖達賴喇嘛的可能性，表示未先與中國大陸商議就這麼做，會引發與北京之間的「危機」。法新社報導，馬克宏在對美國國是訪問尾聲前往市政廳與喬治華盛頓大學（George...,,,51.0
新頭殼newtalk,101661,2018-04-27 15:30:06 SGT,Link,27,3,0,0,0,2,0,18,0,,0,0,0,https://www.facebook.com/Newtalk.Page/posts/2017620644933990,成功說服黨團支持政院版軍改 陳菊：鬆了一口氣,https://newtalk.tw/news/view/2018-04-27/122440,,成功說服黨團支持政院版軍改 陳菊：鬆了一口氣 | 政治 | 新頭殼 Newtalk,為推動行政院版的軍人年改草案，總統府秘書長陳菊今（27）日首度赴立法院與民進黨團溝通，聽取綠委意見，但由於綠委意見分歧，最後以無記名投票方式，決定支持行政院版。對此，陳菊會後受訪表示，「鬆了一口氣！」行....,,,50.0
新頭殼newtalk,101661,2018-04-27 14:50:04 SGT,Link,29,6,0,0,0,2,0,13,0,,0,0,0,https://www.facebook.com/Newtalk.Page/posts/2017595514936503,民進黨團最終以投票確認支持政院版軍人年改 - - - - - 💡新頭殼LINE@生活圈底家啦～ https://goo.gl/fEros4:=:https://line.me/R/ti/p/@boq3291t,https://newtalk.tw/news/view/2018-04-27/122436,,綠委唇槍舌戰討論軍改 最後投票決定支持政院版 | 政治 | 新頭殼 Newtalk,民進黨團今早舉行黨團大會討論軍人年改，總統府秘書長陳菊也到場與綠委們溝通，由於綠委們針對最高俸率部分意見分歧，最後以無記名投票決定。稍早，總召柯建銘受訪表示，經過兩次發言討論後，多數人決定支持行政院。...,,,50.0
新頭殼newtalk,101657,2018-04-26 17:25:59 SGT,Link,13,4,0,0,0,5,1,26,0,,0,0,0,https://www.facebook.com/Newtalk.Page/posts/2016577928371595,又來了！態度還很狂！,https://newtalk.tw/news/view/2018-04-26/122320,,中國軍機又來繞島騷擾 嗆聲「中華民國」 譏「牛逼」 | 中國 | 新頭殼 Newtalk,「中華民國空軍廣播，中華民國空軍廣播，位於東經1173091，北緯223404，航向140，高度……」，今天上午10時49分，我空軍戰管透過雷達發現中國軍機再度闖入我防空識別區，進行「繞島巡航」任務之際，立即按處置程序，透過無....,,,49.0
新頭殼newtalk,101657,2018-04-26 15:10:03 SGT,Link,30,10,2,0,0,3,0,4,0,,0,0,0,https://www.facebook.com/Newtalk.Page/posts/2016491931713528,攻擊警察等於攻擊公權力 賴揆：由法務部研究「襲警罪」,https://newtalk.tw/news/view/2018-04-26/122321,,攻擊警察等於攻擊公權力 賴揆：由法務部研究「襲警罪」 | 政治 | 新頭殼 Newtalk,行政院長賴清德今（26）日下午出席第37屆行政院文化獎頒獎典禮受訪指出，政委羅秉成在院會中提到，也許可以研究攻擊警察的罪與妨害公務要有所區隔，因為攻擊警察等於攻擊公權力，跟一般的妨害公務在程度上會有一些不.....,,,49.0
新頭殼newtalk,101657,2018-04-26 12:30:02 SGT,Link,40,2,1,0,0,4,0,0,0,,0,0,0,https://www.facebook.com/Newtalk.Page/posts/2016377701724951,反年改脫序行為 黃重諺：總統第一時間下達兩指示,https://newtalk.tw/news/view/2018-04-26/122292,,反年改脫序行為 黃重諺：總統第一時間下達兩指示 | 司法 | 新頭殼 Newtalk,反年改團體抗議現場衝突不斷，甚至做出許多令人瞠目的脫序行為。昨(25)日下午，「八百壯士」包圍立法院，並且圍毆執法員警以及記者，甚至耽誤台大醫院病患送醫、就醫時間，引起社會反彈。今(26)日，Hit Fm聯播網《蔻蔻早....,,,47.0
新頭殼newtalk,101657,2018-04-26 17:10:03 SGT,Link,43,3,0,0,0,0,0,0,0,,0,0,0,https://www.facebook.com/Newtalk.Page/posts/2016569401705781,體改新勢力唐聖捷、張祐銓 披時力戰袍選新北市議員,https://newtalk.tw/news/view/2018-04-26/122344,,體改新勢力唐聖捷、張祐銓 披時力戰袍選新北市議員 | 政治 | 新頭殼 Newtalk,時代力量新北黨部今（26）日在新北市議會前召開記者會，黨部主委黃國昌宣布將加入兩位生力軍。分別是參選新北市第二選區（新莊、泰山、五股、林口）的張祐銓，以及參選第五選區（中和）市議員的唐聖捷。黃國昌表示，....,,,46.0
新頭殼newtalk,101657,2018-04-26 13:41:41 SGT,Link,14,5,2,0,3,15,0,7,0,,0,0,0,https://www.facebook.com/Newtalk.Page/posts/2016425331720188,#快訊🔥🔥🔥 遊行解散了！！！,https://newtalk.tw/news/view/2018-04-26/122302,,快訊》暴力惹議 八百壯士宣布解散 暫時撤離立院 | 政治 | 新頭殼 Newtalk,反年改團體八百壯士從昨（25）日開始持續在立法院前進行「護憲維權」的陳情抗議，場面激烈，衝突不斷，甚至還爆流血衝突。八百壯士副指揮官吳斯懷剛剛宣布解散，會暫時撤離立院，停止目前的抗爭行動。另外，反年改團....,,,46.0
新頭殼newtalk,101657,2018-04-26 11:30:03 SGT,Link,17,6,1,1,0,2,0,18,0,,0,0,0,https://www.facebook.com/Newtalk.Page/posts/2016333458396042,清晨對記者潑尿後 反年改團體繞街喊口號,https://newtalk.tw/news/view/2018-04-26/122271,,清晨對記者潑尿後 反年改團體繞街喊口號 | 社會 | 新頭殼 Newtalk,反年改團體今（26）日早上繼續在立法院外抗議遊行，清晨傳出有一名男子疑似向記者潑灑尿液，但北市警局指出，那是礦泉水，隨後八百壯士副指揮官吳斯懷再度出面道歉，但他強調該名男子「不是我們的人。」反年改團體約....,,,45.0
新頭殼newtalk,101661,2018-04-27 20:00:05 SGT,Link,38,0,4,0,2,0,0,0,0,,0,0,0,https://www.facebook.com/Newtalk.Page/posts/2017813981581323,美大學發現新塑膠聚合物 可輕鬆回收無毒分解,https://newtalk.tw/news/view/2018-04-27/122475,,美大學發現新塑膠聚合物 可輕鬆回收無毒分解 | 科技 | 新頭殼 Newtalk,台灣日前才正式起步限塑政策，為的就是要保護環境，人們之所以熱愛使用塑膠，原因在於其價格低廉、方便，但卻礙於難以回收，對環境有著相當大的傷害，但近日美國科羅拉多州立大學，就發現一種與塑膠非常相似的聚合物...,,,44.0
新頭殼newtalk,101661,2018-04-27 14:10:05 SGT,Link,7,9,0,0,1,15,0,12,0,,0,0,0,https://www.facebook.com/Newtalk.Page/posts/2017570948272293,延宕超過百日的台大校長遴選案，今天可望有結論。台大自主聯盟今天在校園內義賣寫著「爺們」等字樣的T恤，支持大學自治和校長當選人管中閔。,https://newtalk.tw/news/view/2018-04-27/122435,,台大生製爺們T挺管 管中閔現身感謝 | 政治 | 新頭殼 Newtalk,延宕超過百日的台大校長遴選案，今天可望有結論。台大自主聯盟今天在校園內義賣寫著「爺們」等字樣的T恤，支持大學自治和校長當選人管中閔。台灣大學校長遴選委員會1月5日選出中央研究院院士管中閔為新校長，原預訂2.....,,,44.0
新頭殼newtalk,101657,2018-04-26 11:20:02 SGT,Link,43,1,0,0,0,0,0,0,0,,0,0,0,https://www.facebook.com/Newtalk.Page/posts/2016326708396717,蘇貞昌表示，他今天除了向游錫堃請教許多事情外，也邀請游擔任他競選總部榮譽主委，游錫堃一口答應願意全力協助，讓他很感謝。,https://newtalk.tw/news/view/2018-04-26/122272,,蘇游會 游錫堃一口答應擔任蘇競選總部榮譽主委 | 政治 | 新頭殼 Newtalk,民進黨昨（25）日通過徵召提名前行政院長參選新北市長，蘇貞昌今（26）日一早就前往台北市宜蘭縣同鄉會拜會前行政院長游錫堃，兩人相談甚歡長達一小時。蘇貞昌表示，他今天除了向游錫堃請教許多事情外，也邀請游擔任.....,,,44.0
新頭殼newtalk,101657,2018-04-26 09:31:03 SGT,Link,40,1,0,0,0,0,0,0,0,,0,0,0,https://www.facebook.com/Newtalk.Page/posts/2016240238405364,民進黨新北整合再前進一步！,https://newtalk.tw/news/view/2018-04-26/122261,,新北整合！蘇貞昌、游錫堃相見歡 | 政治 | 新頭殼 Newtalk,民進黨中執會昨（25）日通過提名前行政院長蘇貞昌參選新北市長，蘇貞昌今（26）日上午赴台北市宜蘭縣同鄉會與前行政院長游錫堃會面。游錫堃特地在電梯外迎接蘇貞昌，兩人一見面後互相握手致意，隨即進入密室會談。新.....,,,41.0
新頭殼newtalk,101657,2018-04-26 19:30:21 SGT,Link,27,3,4,2,1,3,0,0,0,,0,0,0,https://www.facebook.com/Newtalk.Page/posts/2016668111695910,印尼走私冰毒 台8名毒販遭判死刑,https://newtalk.tw/news/view/2018-04-26/122357,,印尼走私冰毒 台8名毒販遭判死刑 | 國際 | 新頭殼 Newtalk,印尼毒品問題猖獗，因此總統佐科威（Joko Widodo）2014年甫上任，便極力改善此問題，致力打擊毒品。佐科威曾接受半島電視台英語頻道採訪，討論關於改善毒品問題的決心，並祭出嚴刑峻罰懲治毒品罪犯，無論是否為印尼國民，...,,,40.0
新頭殼newtalk,101657,2018-04-26 20:40:05 SGT,Link,21,3,0,0,0,14,0,0,0,,0,0,0,https://www.facebook.com/Newtalk.Page/posts/2016729981689723,民進黨南市議員初選競爭激烈 老將落馬揚言退黨參選,https://newtalk.tw/news/view/2018-04-26/122359,,民進黨南市議員初選競爭激烈 老將落馬揚言退黨參選 | 政治 | 新頭殼 Newtalk,民進黨台南市議員初選競爭激烈，面對新人挑戰，繼政壇老將唐碧娥之後，又一資深市議員落馬。民進黨台南市議員第二選區初選民調揭曉，現任市議員侯澄財意外落敗。侯澄財對此表示，他長期為民服務、為民進黨拚到這樣，...,,,38.0
新頭殼newtalk,101661,2018-04-27 10:50:05 SGT,Link,35,0,0,0,1,0,0,0,0,,0,0,0,https://www.facebook.com/Newtalk.Page/posts/2017433898285998,金正恩板門店會談快閃 晚上就回平壤,https://newtalk.tw/news/view/2018-04-27/122397,,金正恩板門店會談快閃 晚上就回平壤 | 國際 | 新頭殼 Newtalk,朝鮮最高領導人金正恩，成為第1位踏足韓國土地的元首，創造歷史之餘卻也沒有打算在韓國多逗留。朝鮮中央通訊社27日一早報導，金正恩前往「板門店南方地區」進行歷史性會談後，將在晚上結束會談日程後，返回平壤。朝中...,,,36.0
新頭殼newtalk,101657,2018-04-26 11:40:02 SGT,Link,22,5,0,2,0,4,0,3,0,,0,0,0,https://www.facebook.com/Newtalk.Page/posts/2016340578395330,反年改立院衝突嚴重 台北市警局：有57人脫序違法遭逮,https://newtalk.tw/news/view/2018-04-26/122276,,反年改立院衝突嚴重 台北市警局：有57人脫序違法遭逮 | 政治 | 新頭殼 Newtalk,反軍人年金改革團體八百壯士25日到立法院外陳抗，不僅與警察對峙，甚至毆打記者，造成許多人受傷，台北市警察局今(26)日表示，經偵訊後，聲援活動群眾有9人依妨害公務及傷害送辦、48人違反社會秩序法函送，訊後將分別移...,,,36.0
新頭殼newtalk,101661,2018-04-27 11:30:07 SGT,Link,28,3,0,1,0,1,0,1,0,,0,0,0,https://www.facebook.com/Newtalk.Page/posts/2017461908283197,你們滿意嗎？🤔,https://newtalk.tw/news/view/2018-04-27/122399,,民調：各有近5成民眾滿意 蔡英文在國防及外交事務表現 | 政治 | 新頭殼 Newtalk,兩岸政策協會今(27)日公布「小英國防兩岸外交表現滿意度」民意調查結果，顯示47.1%民眾滿意蔡英文總統在國防事務上的表現，不滿意者佔45.4%。在外交事務表現方面，滿意蔡英文表現的民眾佔49.5%，不滿意者佔46.0%。此外，有49....,,,34.0
新頭殼newtalk,101661,2018-04-27 14:00:04 SGT,Link,29,0,1,2,0,0,0,0,0,,0,0,0,https://www.facebook.com/Newtalk.Page/posts/2017564541606267,參訪亞航 蔡英文：「國機國造」的政策不會改變,https://newtalk.tw/news/view/2018-04-27/122433,,參訪亞航 蔡英文：「國機國造」的政策不會改變 | 政治 | 新頭殼 Newtalk,蔡英文總統今（27）日上午參訪亞洲航空公司，肯定其為籌建台灣新一代的航空維修能量的努力，並強調「國機國造」的政策不會改變，未來不只要造自己的飛機，還要會修自己的飛機，連別人的飛機也會修。蔡英文抵達後首先....,,,32.0
新頭殼newtalk,101657,2018-04-26 11:50:03 SGT,Link,25,0,4,0,1,0,0,0,0,,0,0,0,https://www.facebook.com/Newtalk.Page/posts/2016348295061225,#盧修一與他的時代 盧修一在27歲之前，是個黨國教育洗腦下的樣板，忠黨愛國。就讀建國中學時，他曾經想去報考陸軍官校。他留學歐洲，七年，從頭認識台灣，也找到相扶一生的摯愛伴侶陳郁秀。他被捕入獄，三年，徹底扭轉他對國民黨的誤認，重新找回自我。 - - - - - 💡加入新頭殼LINE@生活圈了嗎？ https://goo.gl/fEros4:=:https://line.me/R/ti/p/@boq3291t,https://newtalk.tw/news/view/2018-04-26/121923,,盧仔新書試讀5》盧修一年輕時 一度曾夢想當軍事家 | 政治 | 新頭殼 Newtalk,盧修一在27歲之前，是個黨國教育洗腦下的樣板，忠黨愛國。就讀建國中學時，他曾經想去報考陸軍官校。他留學歐洲，七年，從頭認識台灣，也找到相扶一生的摯愛伴侶陳郁秀。他被捕入獄，三年，徹底扭轉他對國民黨的誤認....,,,30.0
新頭殼newtalk,101657,2018-04-27 08:33:47 SGT,Link,11,2,4,0,3,0,2,7,0,,0,0,0,https://www.facebook.com/Newtalk.Page/posts/2017332864962768,在民報記者鍾孟軒被反年改抗爭的八百壯士圍毆的當下，新頭殼記者黃韋銓進行採訪拍照，也一樣被群眾圍毆踹踢，經過24小時後，仍舊餘悸猶存…,https://newtalk.tw/news/view/2018-04-26/122363,,直擊》搶相機、圍毆、狂踹 回顧反年改如何戕害新聞自由 | 政治 | 新頭殼 Newtalk,在八百壯士副指揮官吳斯懷今（26）天下午宣布停止遊行後，反年改團體已漸漸從立法院散去，但回想起自己昨天被反年改人士群起圍毆狂踹，除了當下的恐懼外，仍感到莫名而氣憤不已。回顧昨天早上的年改公聽會，民進黨為....,,,29.0
新頭殼newtalk,101657,2018-04-26 08:46:11 SGT,Link,27,0,0,0,2,0,0,0,0,,0,0,0,https://www.facebook.com/Newtalk.Page/posts/2016205241742197,老布希脫離險境轉普通病房 急著看NBA季後賽,https://newtalk.tw/news/view/2018-04-26/122253,,老布希脫離險境轉普通病房 急著看NBA季後賽 | 國際 | 新頭殼 Newtalk,才送髮妻芭芭拉（Barbara Bush）最後一程的美國前總統老布希（George H.W. Bush），病情好轉，已經轉到普通病房，高齡93歲的他在推特發出感謝醫院照顧的短文後，就急著投入NBA籃球季後賽的戰情，把自己的病情拋到腦後。老布希在...,,,29.0
新頭殼newtalk,101661,2018-04-27 10:00:04 SGT,Link,21,0,0,0,1,6,0,0,0,,0,0,0,https://www.facebook.com/Newtalk.Page/posts/2017394758289912,平壤談判信用不良 美學者憂歷史重演,https://newtalk.tw/news/view/2018-04-27/122395,,平壤談判信用不良 美學者憂歷史重演 | 國際 | 新頭殼 Newtalk,南韓總統文在寅將與北韓領導人金正恩展開「文金會」，文在寅追求的半島和平有了新開始。不過，仍有不少美國學者擔憂平壤的談判信用不良，重演徒勞無功的過往歷史。文在寅追求朝鮮半島和平，不過他和前總統金大中及盧...,,,28.0
新頭殼newtalk,101657,2018-04-26 16:20:03 SGT,Link,22,2,1,0,0,3,0,0,0,,0,0,0,https://www.facebook.com/Newtalk.Page/posts/2016532871709434,主持人周玉蔻問林鶴明離開台北市府，是否「拋棄柯文哲」？林鶴明否認，表示本來就有規劃離開台北市政府，正好有進總統府服務的機會，當然義不容辭。,https://newtalk.tw/news/view/2018-04-26/122322,,離北市府進總統府 周玉蔻笑：蔡英文挖角林鶴明? | 政治 | 新頭殼 Newtalk,前台北市府發言人林鶴明現職總統府發言人，今 (26) 日應邀上Hit Fm聯播網節目《蔻蔻早餐》受訪。主持人周玉蔻問林鶴明離開台北市府，是否「拋棄柯文哲」？林鶴明否認，表示本來就有規劃離開台北市政府，正好有進總統府服...,,,28.0
新頭殼newtalk,101661,2018-04-27 19:20:05 SGT,Link,27,0,0,0,0,0,0,0,0,,0,0,0,https://www.facebook.com/Newtalk.Page/posts/2017781721584549,民進黨南市議員初選完成 17位新人過關,https://newtalk.tw/news/view/2018-04-27/122473,,民進黨南市議員初選完成 17位新人過關 | 政治 | 新頭殼 Newtalk,民進黨台南市議員初選民調全部完成，各區競爭激烈，但過程和平順利，民進黨台南市黨部今（27）日公佈各區議員提名名單，名單如下：第一選區—（後壁、東山、白河、鹽水、新營、柳營）賴惠員、李宗翰、沈家鳳、劉米山....,,,27.0
新頭殼newtalk,101661,2018-04-27 16:40:22 SGT,Link,23,3,0,1,0,0,0,0,0,,0,0,0,https://www.facebook.com/Newtalk.Page/posts/2017664551596266,不用核電要用甚麼？日本第一能源策士週日說給你聽,https://newtalk.tw/news/view/2018-04-27/122457,,不用核電要用甚麼？日本第一能源策士週日說給你聽 | 環保 | 新頭殼 Newtalk,帶領福島居民打官司的日本反核律師河合弘之經常被問「不用核電要用甚麼」，他在2016年與能源專家飯田哲也所長走訪7個國家與地區，製作了「日本再生－尋找新能源典範」記錄片。從各國實際訪談發現，再生能源產業會產生....,,,27.0
新頭殼newtalk,101657,2018-04-26 12:20:02 SGT,Link,23,1,2,0,0,1,0,0,0,,0,0,0,https://www.facebook.com/Newtalk.Page/posts/2016370708392317,深澳電廠爭議 游錫堃為蘇酸侯：不應選舉才關心環保問題,https://newtalk.tw/news/view/2018-04-26/122282,,深澳電廠爭議 游錫堃為蘇酸侯：不應選舉才關心環保問題 | 政治 | 新頭殼 Newtalk,民進黨新北市長參選人蘇貞昌今（26）日赴台北市宜蘭同鄉會拜會前行政院長游錫堃，游也一口答應擔任蘇競選總部榮譽主委。有媒體問到國民黨新北市長參選人侯友宜昨在臉書喊話，希望蘇貞昌有空去八斗子，看看深澳電廠對....,,,27.0
新頭殼newtalk,101657,2018-04-27 07:20:04 SGT,Link,26,0,0,0,0,0,0,0,0,,0,0,0,https://www.facebook.com/Newtalk.Page/posts/2017283038301084,板門店我來了！金正恩離開平壤 前進北緯38度線,https://newtalk.tw/news/view/2018-04-27/122384,,板門店我來了！金正恩離開平壤 前進北緯38度線 | 國際 | 新頭殼 Newtalk,歷史性的兩韓峰會台北時間今早8點半登場，根據北韓官方中央通信社（KCNA）的報導，北韓領導人金正恩剛才稍早之前已經離開首都平壤，前往兩韓邊界的板門店，準備與南韓總統文在寅進行會談。南韓聯合新聞通訊社（Yonhap）....,,,26.0
新頭殼newtalk,101657,2018-04-26 21:40:03 SGT,Link,20,0,0,2,0,4,0,0,0,,0,0,0,https://www.facebook.com/Newtalk.Page/posts/2016786708350717,回應中國對台文攻武嚇 獨派團體 : 空口白話自取其辱,https://newtalk.tw/news/view/2018-04-26/122376,,回應中國對台文攻武嚇 獨派團體 : 空口白話自取其辱 | 政治 | 新頭殼 Newtalk,台灣社、台灣北社、台灣中社、台灣南社、台灣東社(花蓮)、台灣東社(台東)、台灣客社、台灣教師聯盟今 (26) 日晚間發表共同聲明，表示中國國台辦連日來發表恐嚇台獨的言論，台灣人對此除了厭煩，只會更討厭和排斥中國政.....,,,26.0
新頭殼newtalk,101661,2018-04-27 14:09:36 SGT,Link,21,1,2,0,0,0,0,0,0,,0,0,0,https://www.facebook.com/Newtalk.Page/posts/2017570544939000,長知識惹！ 原來平壤冷麵長這樣！,https://newtalk.tw/news/view/2018-04-27/122420,,蛤？！金正恩口中的「冷麵」 不是涼麵 | 國際 | 新頭殼 Newtalk,今天在朝鮮半島上舉行的兩韓峰會受到全球矚目，南北韓領導人見面時無論說了什麼都受到外界放大鏡檢視，即使寒暄問暖也可能格外有深意。「我從平壤帶來了冷麵，平壤並不遠，很近」。這是金正恩在板門店「和平之家」的...,,,24.0
新頭殼newtalk,101661,2018-04-27 13:30:06 SGT,Link,14,3,5,0,1,0,0,1,0,,0,0,0,https://www.facebook.com/Newtalk.Page/posts/2017545591608162,長期關注勞工議題的民進黨立委鍾孔炤今天表示，唯有落實「勞動教育」，普及勞動知識，才能徹底翻轉血汗過勞的現況。,https://newtalk.tw/news/view/2018-04-27/122425,,勞權意識薄弱！ 綠委提修法籲雇主、勞工都要上課 | 政治 | 新頭殼 Newtalk,五一勞動節前夕，發生國道員警疑似被連續出勤22日駕駛撞擊傷亡，勞工過勞問題再次浮上檯面。長期關注勞工議題的民進黨立委鍾孔炤今天（27日）表示，唯有落實「勞動教育」，普及勞動知識，才能徹底翻轉血汗過勞的現況.....,,,24.0
新頭殼newtalk,101661,2018-04-27 13:00:04 SGT,Link,19,1,1,0,1,2,0,0,0,,0,0,0,https://www.facebook.com/Newtalk.Page/posts/2017524961610225,平壤冷麵不是涼麵 金正恩：平壤並不遠,https://newtalk.tw/news/view/2018-04-27/122420,,平壤冷麵不是涼麵 金正恩：平壤並不遠 | 國際 | 新頭殼 Newtalk,今天在朝鮮半島上舉行的兩韓峰會受到全球矚目，南北韓領導人見面時無論說了什麼都受到外界放大鏡檢視，即使寒暄問暖也可能格外有深意。「我從平壤帶來了冷麵，平壤並不遠，很近」。這是金正恩在板門店「和平之家」的...,,,24.0
新頭殼newtalk,101661,2018-04-27 20:10:05 SGT,Link,8,11,1,0,0,1,0,1,0,,0,0,0,https://www.facebook.com/Newtalk.Page/posts/2017823994913655,兩韓和平對話 徐國勇：兩岸可以當做借鏡,https://newtalk.tw/news/view/2018-04-27/122489,,兩韓和平對話 徐國勇：兩岸可以當做借鏡 | 政治 | 新頭殼 Newtalk,南韓總統文在寅與北韓領導人金正恩今（27）日簽署板門店宣言，停止一切敵對行為，共同爭取在今年內宣布結束戰爭狀態。對此，行政院發言人徐國勇晚間回應指出，和平對話蠻重要的，兩岸可以當做借鏡。徐國勇說，區域和....,,,22.0
新頭殼newtalk,101661,2018-04-27 16:26:24 SGT,Link,19,1,0,0,0,1,1,0,0,,0,0,0,https://www.facebook.com/Newtalk.Page/posts/2017656834930371,兩韓領導人文在寅和金正恩，下午在北緯38度軍事分界線附近，共同進行了紀念植樹活動，祈願朝鮮半島和平與繁榮。,https://newtalk.tw/news/view/2018-04-27/122450,,象徵朝韓和解！金正恩、文在寅合種和平繁榮之樹 | 國際 | 新頭殼 Newtalk,兩韓峰會今天在板門店舉行，雙方領導人文在寅和金正恩，在結束上午會談、各自用餐與休息後，下午在北緯38度軍事分界線附近，共同進行了紀念植樹活動，祈願朝鮮半島和平與繁榮。據韓媒報導，這株精心挑選的樹木，是象....,,,22.0
