新頭殼newtalk,101657,2018-04-27 07:30:04 SGT,Link,7,1,0,0,0,0,0,0,0,,0,0,0,https://www.facebook.com/Newtalk.Page/posts/2017291504966904,軟硬兼施!?文金會前 美軍試射洲際導彈 或為震懾金正恩,https://newtalk.tw/news/view/2018-04-27/122382,,軟硬兼施!?文金會前 美軍試射洲際導彈 或為震懾金正恩 | 國際 | 新頭殼 Newtalk,美國空軍前（25）日宣布成功試射一枚洲際彈道導彈，這枚義勇兵3型（Minuteman III）洲際導彈於當地時間早晨5點26分在加州范登堡空軍基地向太平洋某個特定目標發射。法廣（RFI）報導認為，將原定在今年2月進行的義勇兵3型洲際...,,,8.0
新頭殼newtalk,101657,2018-04-26 22:10:03 SGT,Link,8,0,0,0,0,0,0,0,0,,0,0,0,https://www.facebook.com/Newtalk.Page/posts/2016810935014961,莫習會 莫迪：將以戰略角度審視中印關係,https://newtalk.tw/news/view/2018-04-26/122381,,莫習會 莫迪：將以戰略角度審視中印關係 | 國際 | 新頭殼 Newtalk,印度總理莫迪今天在推特主動透露，他將與中國國家主席習近平在明天起的中印領袖非正式峰會上，就雙邊和全球重要議題交換意見，從戰略角度審視中印關係。莫迪預定今晚將搭機啟程前往中國，準備到武漢參加明天起的莫習...,,,8.0
新頭殼newtalk,101661,2018-04-27 20:50:06 SGT,Link,2,0,0,0,5,0,0,0,0,,0,0,0,https://www.facebook.com/Newtalk.Page/posts/2017859671576754,北部男子染麻疹 林口長庚群聚再增一例,https://newtalk.tw/news/view/2018-04-27/122488,,北部男子染麻疹 林口長庚群聚再增一例 | 社會 | 新頭殼 Newtalk,疾管署今天宣布林口長庚麻疹群聚事件再增一例確診個案，患者是北部一名20多歲男性，22日肢體出疹、今天確診，目前正進行居家隔離，全台至今共有24人感染麻疹。台灣今年3月29日公布首例境外移入麻疹個案，疫情延燒至今，...,,,7.0
新頭殼newtalk,101661,2018-04-27 09:52:21 SGT,Link,7,0,0,0,0,0,0,0,0,,0,0,0,https://www.facebook.com/Newtalk.Page/posts/2017388361623885,最好寫到做到,https://newtalk.tw/news/view/2018-04-27/122391,,金正恩前進和平之家 親筆留言「和平歷史的開始」 | 國際 | 新頭殼 Newtalk,兩韓世紀峰會27日上午正式展開，朝鮮領導人金正恩攜韓國總統文在寅進入板門店和平之家，親筆簽下留言簿，還說新的歷史就是「和平歷史的開始」，而他的妹妹、現任朝鮮勞動黨中央政治局候補委員、中央委員會宣傳部副部....,,,7.0
新頭殼newtalk,101657,2018-04-26 20:30:03 SGT,Link,6,0,0,0,0,0,0,1,0,,0,0,0,https://www.facebook.com/Newtalk.Page/posts/2016719771690744,校長遴選瑕疵陽明也有 張善政：教部是否回溯處理?,https://newtalk.tw/news/view/2018-04-26/122369,,校長遴選瑕疵陽明也有 張善政：教部是否回溯處理? | 政治 | 新頭殼 Newtalk,前行政院長張善政今（26）日表示，陽明大學選校長也遇到遴選瑕疵問題，反問教育部如果管中閔涉嫌迴避事項違反行政程序，難道要回溯去處理陽明大學校長的問題嗎？有媒體引述政府高層消息指，教育部昨天召開跨部會諮詢....,,,7.0
新頭殼newtalk,101657,2018-04-26 17:08:01 SGT,Link,7,0,0,0,0,0,0,0,0,,0,0,0,https://www.facebook.com/Newtalk.Page/posts/2016567765039278,選舉到了！,https://newtalk.tw/news/view/2018-04-26/122340,,選舉耳語 明年復徵水井規費？李進勇闢謠：照顧農民 不會朝令夕改（影） | 政治 | 新頭殼 Newtalk,雲林縣政府從去年開始免收水權規費，卻遭有心人士造謠為「明年初會重徵水井規費」，雲林縣長李進勇今（26）日召開「杜絕造謠捍衛行政」記者會釐清此謠言，表達對於惡意造謠散播者，絕不姑息的決心。雲林縣議員和多位....,,,7.0
新頭殼newtalk,101657,2018-04-26 06:46:11 SGT,Link,7,0,0,0,0,0,0,0,0,,0,0,0,https://www.facebook.com/Newtalk.Page/posts/2016120111750710,與文在寅明會談 金正恩承諾關閉核試場 原來是因為……,https://newtalk.tw/news/view/2018-04-26/122248,,與文在寅明會談 金正恩承諾關閉核試場 原來是因為…… | 國際 | 新頭殼 Newtalk,中國地震學家判定，北韓去年進行大規模試爆後，豐溪里核子試驗場出現部分崩塌，已不堪使用。法新社報導，北韓領導人金正恩上週宣布將停止核試及試射長程飛彈，並承諾將關閉東北萬塔山下的豐溪里核子試驗場。金正恩27....,,,7.0
新頭殼newtalk,101661,2018-04-27 18:30:07 SGT,Link,2,2,0,0,0,0,0,2,0,,0,0,0,https://www.facebook.com/Newtalk.Page/posts/2017739351588786,台中市府時薪只給100? 市府 : 未找學生做工作人員,https://newtalk.tw/news/view/2018-04-27/122466,,台中市府時薪只給100? 市府 : 未找學生做工作人員 | 社會 | 新頭殼 Newtalk,台中市政府預計將於5月19日於靜宜大學舉辦員工運動會，今 (27) 日遭靜宜學生會指控工作六小時費用只給600元，平均時薪僅100元，疑有違反勞基法情事，主辦活動的市府人事處澄清，市府係徵詢靜宜大學體育室，推薦適合體育教...,,,6.0
新頭殼newtalk,101661,2018-04-27 15:35:55 SGT,Link,5,0,1,0,0,0,0,0,0,,0,0,0,https://www.facebook.com/Newtalk.Page/posts/2017623644933690,出現類似症狀不要輕忽！,https://newtalk.tw/news/view/2018-04-27/122439,,生活Fun頭殼,麻疹症狀像感冒！衛生局籲：曾接觸患者又發燒快就醫,,,6.0
新頭殼newtalk,101657,2018-04-26 21:50:38 SGT,Link,6,0,0,0,0,0,0,0,0,,0,0,0,https://www.facebook.com/Newtalk.Page/posts/2016795401683181,迎金正恩 南韓儀仗隊將奏阿里郎,https://newtalk.tw/news/view/2018-04-26/122377,,迎金正恩 南韓儀仗隊將奏阿里郎 | 國際 | 新頭殼 Newtalk,北韓國務委員長金正恩明天上午將跨過板門店兩韓軍事分界線，踏上南韓土地，迎接他的是身著多彩民族服裝、吹奏民謠阿里郎的南韓傳統儀仗隊。南韓聯合新聞通訊社報導，青瓦台幕僚長、南北韓高峰會籌備委員會主席任鐘皙...,,,6.0
新頭殼newtalk,101657,2018-04-26 17:50:03 SGT,Link,4,0,0,0,0,2,0,0,0,,0,0,0,https://www.facebook.com/Newtalk.Page/posts/2016592171703504,侯周會大和解 侯友宜：受益良多 將再親訪周錫瑋,https://newtalk.tw/news/view/2018-04-26/122341,,侯周會大和解 侯友宜：受益良多 將再親訪周錫瑋 | 政治 | 新頭殼 Newtalk,國民黨新北市長參選人侯友宜今（26）日早到汐止拜票，對於昨晚與前縣長周錫瑋會面，兩度感謝周錫瑋提供市政意見，表示會面談了一個多小時，氣氛非常融洽，他受益良多，會找時間帶領競選團隊再親自拜訪周縣長。新北市....,,,6.0
新頭殼newtalk,101657,2018-04-26 16:55:05 SGT,Link,6,0,0,0,0,0,0,0,0,,0,0,0,https://www.facebook.com/Newtalk.Page/posts/2016556561707065,受境外污染物傳輸影響，臭氧濃度偏高，富貴角、陽明達橘色提醒，特別是馬祖，已達紫色警報，敏感族群應減少在戶外活動，必要外出可配戴口罩。,https://newtalk.tw/news/view/2018-04-26/122312,,生活Fun頭殼,境外汙染臭氧惹的禍！馬祖空品紫爆ing,,,6.0
新頭殼newtalk,101657,2018-04-26 13:20:02 SGT,Link,6,0,0,0,0,0,0,0,0,,0,0,0,https://www.facebook.com/Newtalk.Page/posts/2016412398388148,盧仔新書試讀8》盧修一抵歐洲 台灣青年敲醒忠黨學生,https://newtalk.tw/news/view/2018-04-26/122275,,盧仔新書試讀8》盧修一抵歐洲 台灣青年敲醒忠黨學生 | 政治 | 新頭殼 Newtalk,留歐始知 台灣歷史盧修一抵達歐洲大陸的這一年──西元一九六八年的五月，在法國，以巴黎索邦大學為基地，全國正如火如荼地引發「五月學潮」，學生和工人以罷課和罷工的實際行動，要求校園和社會提供更自由開放、公.....,,,6.0
新頭殼newtalk,101657,2018-04-26 13:10:02 SGT,Link,6,0,0,0,0,0,0,0,0,,0,0,0,https://www.facebook.com/Newtalk.Page/posts/2016406231722098,自來水管連三爆 中市議員要求總體檢,https://newtalk.tw/news/view/2018-04-26/122281,,自來水管連三爆 中市議員要求總體檢 | 社會 | 新頭殼 Newtalk,台中市逢甲夜市外圍的西屯區河南路二段、逢大路口，今（26）日清晨5點多又發生自來水管爆裂，這是一個月來的第三次，當地市議員陳淑華、里長張文平要求自來水公司儘速更換老舊管線。台中市議員陳淑華一大早接獲逢福里...,,,6.0
新頭殼newtalk,101661,2018-04-27 20:30:06 SGT,Link,3,0,0,0,0,0,0,2,0,,0,0,0,https://www.facebook.com/Newtalk.Page/posts/2017840491578672,幫朱立倫選連任? 侯友宜大笑回應,https://newtalk.tw/news/view/2018-04-27/122491,,幫朱立倫選連任? 侯友宜大笑回應 | 政治 | 新頭殼 Newtalk,民進黨秘書長洪耀福昨(26)日陪同民進黨新北市長參選人蘇貞昌拜會新北市議會民進黨團時提出「票投侯友宜，就是給朱立倫第三次連任」的說法，侯友宜今天接受媒體訪問時先是大笑三聲用台語說「他又在講什麼」，還推出幕.....,,,5.0
新頭殼newtalk,101661,2018-04-27 11:20:04 SGT,Link,4,1,0,0,0,0,0,0,0,,0,0,0,https://www.facebook.com/Newtalk.Page/posts/2017456061617115,兩韓峰會 日本人關切的是這個,https://newtalk.tw/news/view/2018-04-27/122406,,兩韓峰會 日本人關切的是這個 | 國際 | 新頭殼 Newtalk,第3次兩韓領袖會談今天登場，日本官房長官菅義偉說，期待對解決綁架日本人、核試驗、彈道飛彈等議題，能有正面積極討論，但目前無法評價正在舉行的會談內容與結果。日本放送協會（NHK）報導，菅義偉說，兩韓會談成員.....,,,5.0
新頭殼newtalk,101661,2018-04-27 09:00:04 SGT,Link,5,0,0,0,0,0,0,0,0,,0,0,0,https://www.facebook.com/Newtalk.Page/posts/2017351041627617,MeToo逆襲！天才老爹被控迷姦判有罪 恐將終老獄中,https://newtalk.tw/news/view/2018-04-27/122388,,MeToo逆襲！天才老爹被控迷姦判有罪 恐將終老獄中 | 國際 | 新頭殼 Newtalk,美國老牌諧星比爾寇斯比被控在2004年下藥性侵一名女性友人，今天遭陪審團判定3項罪名成立。這是反對性騷擾風潮席捲全球以來首宗名人性侵審判案，檢方贏得重大勝利。路透社報導，80高齡的比爾寇斯比（Bill Cosby）在1980年代...,,,5.0
新頭殼newtalk,101657,2018-04-26 17:20:03 SGT,Link,1,1,0,0,3,0,0,0,0,,0,0,0,https://www.facebook.com/Newtalk.Page/posts/2016574845038570,東京小子山口達也涉強制猥褻 出面流淚致歉,https://newtalk.tw/news/view/2018-04-26/122343,,東京小子山口達也涉強制猥褻 出面流淚致歉 | 國際 | 新頭殼 Newtalk,日本傑尼斯旗下人氣偶像團體TOKIO（東京小子）成員山口達也涉嫌猥褻女高中生，遭函送檢方偵辦，今天下午他召開記者會流淚致歉。傑尼斯事務所已決定讓他無限期停止演藝事業。46歲的山口是5人組偶像團體TOKIO（東京小子）.....,,,5.0
新頭殼newtalk,101657,2018-04-26 07:46:11 SGT,Link,5,0,0,0,0,0,0,0,0,,0,0,0,https://www.facebook.com/Newtalk.Page/posts/2016161231746598,孫安佐藍色囚衣現身 律師：他尷尬讓國家失望,https://newtalk.tw/news/view/2018-04-26/122251,,孫安佐藍色囚衣現身 律師：他尷尬讓國家失望 | 國際 | 新頭殼 Newtalk,在美國因涉及持有武器、恐怖威脅的18歲台灣交換學生孫安佐（An Tso Sun），在被捕29天後首度在媒體前曝光，現身特拉華縣（Delaware County）上達比的法庭上出庭。他在當地時間25日上午被拍攝到身著白色表袖T恤，外罩藍色囚衣，....,,,5.0
新頭殼newtalk,101661,2018-04-27 18:40:05 SGT,Link,3,0,0,0,0,0,0,1,0,,0,0,0,https://www.facebook.com/Newtalk.Page/posts/2017747008254687,表揚模範勞工 林佳龍：市府是創造雙贏的夥伴,https://newtalk.tw/news/view/2018-04-27/122464,,表揚模範勞工 林佳龍：市府是創造雙贏的夥伴 | 政治 | 新頭殼 Newtalk,五一勞動節馬上就到了，台中市政府今（27）日在潮港城國際美食館舉辦模範勞工表揚活動，市長林佳龍頒獎給模範勞工136位以及12位進用身心障礙績優單位代表，其中中興大學因為連獲三年獲績優單位，今年更獲得楷模獎。林.....,,,4.0
新頭殼newtalk,101661,2018-04-27 16:30:11 SGT,Link,4,0,0,0,0,0,0,0,0,,0,0,0,https://www.facebook.com/Newtalk.Page/posts/2017658674930187,#舌尖上的兩韓 帶你看兩韓峰會出現的佳餚🤓,https://newtalk.tw/news/view/2018-04-27/122456,,兩韓峰會佳餚妙 道道傳遞新「韓」意 (圖) | 國際 | 新頭殼 Newtalk,兩韓峰會今 (27) 日舉行，一早便受到全球各界關注。兩國元首文在寅及金正恩的互動，一同跨越北緯38度板門店界線等，都將成為世紀之舉。但除了會談之外，兩國之間也互相準備了各種佳餚要來招待對方，融合南北韓美食的桌....,,,4.0
新頭殼newtalk,101661,2018-04-27 16:00:05 SGT,Link,4,0,0,0,0,0,0,0,0,,0,0,0,https://www.facebook.com/Newtalk.Page/posts/2017638128265575,中部地區首件危老條例重建案通過 獲40%容積獎勵,https://newtalk.tw/news/view/2018-04-27/122453,,中部地區首件危老條例重建案通過 獲40%容積獎勵 | 政治 | 新頭殼 Newtalk,台中市政府昨（26）日核准通過位於南屯寶山段，屋齡46年的申請重建計畫，為中部地區首例，由於該計畫符合退縮，耐震設計，綠建築，無障礙設計等獎勵項目，再加上3年內之時程獎勵，可獲得40％的容積獎勵。都市發展局今 (...,,,4.0
新頭殼newtalk,101661,2018-04-27 10:20:04 SGT,Link,3,0,0,0,1,0,0,0,0,,0,0,0,https://www.facebook.com/Newtalk.Page/posts/2017409424955112,美煉油廠驚爆20傷 黑煙竄升人員急撤,https://newtalk.tw/news/view/2018-04-27/122390,,美煉油廠驚爆20傷 黑煙竄升人員急撤 | 國際 | 新頭殼 Newtalk,美國威斯康辛州蘇必利爾（Superior）的Husky Energy煉油廠爆炸，黑色濃煙直竄雲霄，目前已知至少有20人受傷，火勢範圍內盡被黑煙籠罩，煉油廠職員及附近居民緊急疏散。當地時間26日上午10時，煉油廠部分設施正關閉進行維修保....,,,4.0
新頭殼newtalk,101661,2018-04-27 09:50:04 SGT,Link,4,0,0,0,0,0,0,0,0,,0,0,0,https://www.facebook.com/Newtalk.Page/posts/2017386441624077,上任府秘後首赴立院 陳菊拜會民進黨團溝通軍改,https://newtalk.tw/news/view/2018-04-27/122392,,上任府秘後首赴立院 陳菊拜會民進黨團溝通軍改 | 政治 | 新頭殼 Newtalk,總統府秘書長陳菊今（27）日早上9點前往立法院拜會民進黨團，並將於黨團大會中溝通軍人年改草案，黨團總召柯建銘與綠委們一早在立院準備迎接。陳菊表示，今天特別來向民進黨團致意，聽聽立委們不同意見。被問到是否將...,,,4.0
新頭殼newtalk,101657,2018-04-26 22:40:04 SGT,Link,4,0,0,0,0,0,0,0,0,,0,0,0,https://www.facebook.com/Newtalk.Page/posts/2016842495011805,人物》天涯刺客黃照夫／巴士底獄1973年春天,https://newtalk.tw/news/view/2018-04-26/122216,,人物》天涯刺客黃照夫／巴士底獄1973年春天 | 政治 | 新頭殼 Newtalk,咖啡廣場驚魂記事經常旅遊法國巴黎的台灣朋友，一定都知道這張照片，就是1789年揭開法國大革命序幕的歷史地點─巴士底獄原址。即使沒去過巴黎，也都曾在歷史教科書裡看過頂頂有名的「巴士底獄」。但是，就在這裡，有.....,,,4.0
新頭殼newtalk,101657,2018-04-26 18:30:03 SGT,Link,3,0,0,0,0,0,0,1,0,,0,0,0,https://www.facebook.com/Newtalk.Page/posts/2016619988367389,尚未接到WHA邀請 陸委會：讓國際社會理解中方的打壓,https://newtalk.tw/news/view/2018-04-26/122354,,尚未接到WHA邀請 陸委會：讓國際社會理解中方的打壓 | 政治 | 新頭殼 Newtalk,世界衛生大會（WHA）即將於5月21日至26日在日內瓦召開，但台灣至今未收到邀請。對此，陸委會發言人邱垂正今（26）日表示，對岸認為台灣參與WHA，必須在「一中原則」下，透過兩岸協商，做出合情合理的安排，這是未顧及台.....,,,4.0
新頭殼newtalk,101657,2018-04-26 15:00:03 SGT,Link,4,0,0,0,0,0,0,0,0,,0,0,0,https://www.facebook.com/Newtalk.Page/posts/2016483418381046,驚人代幣經濟！ LINE副總裁誓打造科技生態系,https://newtalk.tw/news/view/2018-04-26/122314,,驚人代幣經濟！ LINE副總裁誓打造科技生態系 | 科技 | 新頭殼 Newtalk,LINE於今年4月中舉行的DEV WEEK 2018圓滿落幕，全球各地共一千名的LINE開發工程師於首爾齊聚一堂，透過為期四天的深入交流，共同探討IT產業未來將面臨的挑戰，此外也特別針對LINE作為「智慧入口」及一站式通訊平台該如何透過.....,,,4.0
新頭殼newtalk,101657,2018-04-26 10:50:02 SGT,Link,3,0,0,0,0,1,0,0,0,,0,0,0,https://www.facebook.com/Newtalk.Page/posts/2016304175065637,第2次兩韓峰會 金正日問金大中：你害怕來朝鮮嗎？,https://newtalk.tw/news/view/2018-04-26/122254,,第2次兩韓峰會 金正日問金大中：你害怕來朝鮮嗎？ | 國際 | 新頭殼 Newtalk,「文金會」明天（週五）將在板門店內位於韓國境內的「和平之家」登場，這將是朝鮮領導人有史以來首次踏進韓國土地，也是金正恩上任後的第一次兩韓峰會、韓戰結束以來南北韓的第三次領袖會面。二戰後同為分裂國家的東...,,,4.0
新頭殼newtalk,101657,2018-04-26 09:16:11 SGT,Link,4,0,0,0,0,0,0,0,0,,0,0,0,https://www.facebook.com/Newtalk.Page/posts/2016228311739890,個資風暴》蘋果存個資 用戶提要求可下載副本,https://newtalk.tw/news/view/2018-04-26/122258,,個資風暴》蘋果存個資 用戶提要求可下載副本 | 國際 | 新頭殼 Newtalk,社群網站臉書洩漏用戶個資引發眾怒，不少網友關心科技業者究竟掌握多少個人訊息。美媒報導，蘋果公司用戶只要在線上提出要求，可取得個資副本，但流程繁瑣且耗時較長。財經媒體CNBC報導，和臉書與Google相比，蘋果公司.....,,,4.0
新頭殼newtalk,101657,2018-04-26 07:06:11 SGT,Link,3,0,0,0,1,0,0,0,0,,0,0,0,https://www.facebook.com/Newtalk.Page/posts/2016133238416064,史上首次！出席兩韓峰會 金正恩將檢閱南韓軍儀仗隊,https://newtalk.tw/news/view/2018-04-26/122249,,史上首次！出席兩韓峰會 金正恩將檢閱南韓軍儀仗隊 | 國際 | 新頭殼 Newtalk,南韓國防部今天表示，南韓陸海空三軍儀仗隊將為南北韓高峰會談執行禮賓任務，27日在板門店南韓轄區「和平之家」舉行南北韓峰會時，北韓國務委員長金正恩將檢閱南韓軍儀仗隊。南韓聯合新聞通訊社報導，在2000年和2007年.....,,,4.0
新頭殼newtalk,101661,2018-04-27 21:20:05 SGT,Link,1,0,2,0,0,0,0,0,0,,0,0,0,https://www.facebook.com/Newtalk.Page/posts/2017886954907359,才爆性醜聞 瑞典學院又遭金融犯罪調查,https://newtalk.tw/news/view/2018-04-27/122498,,才爆性醜聞 瑞典學院又遭金融犯罪調查 | 國際 | 新頭殼 Newtalk,負責頒發諾貝爾文學獎而地位崇高的瑞典學院（Swedish Academy），近日才捲入性醜聞疑雲。瑞典警方金融犯罪小組今天再宣布，他們已對瑞典學院展開調查行動。瑞典學院院士佛羅絲登松（Katarina Frostenson）的攝影師丈夫阿爾諾（Je...,,,3.0
新頭殼newtalk,101661,2018-04-27 17:10:06 SGT,Link,3,0,0,0,0,0,0,0,0,,0,0,0,https://www.facebook.com/Newtalk.Page/posts/2017681148261273,國巨擬公開收購君耀 溢價幅度約10.7%,https://newtalk.tw/news/view/2018-04-27/122459,,國巨擬公開收購君耀 溢價幅度約10.7% | 財經 | 新頭殼 Newtalk,國巨擬公開收購君耀，預計每股現金新台幣73元作為對價，擬公開收購全數普通股，溢價幅度約10.7%。國巨表示，雙方是協議合意。國巨今天下午舉辦重大訊息說明會。國巨表示，今天召開臨時董事會，通過擬公開收購君耀普通.....,,,3.0
新頭殼newtalk,101661,2018-04-27 13:40:06 SGT,Link,3,0,0,0,0,0,0,0,0,,0,0,0,https://www.facebook.com/Newtalk.Page/posts/2017550674940987,iPhoneX銷售不佳 蘋果Q2主打庫存產量僅800萬支,https://newtalk.tw/news/view/2018-04-27/122424,,iPhoneX銷售不佳 蘋果Q2主打庫存產量僅800萬支 | 科技 | 新頭殼 Newtalk,全球手機市場增長停擺，其中蘋果也受影響甚深，自去年推出的 iPhone X ，在售價昂貴以及使用者換機時間延長的影響之下，銷售持續不佳，而近日就傳出蘋果計畫 2018 第二季 iPhone X 只生產 800 萬支，並指出原因是蘋果於 2017 最.....,,,3.0
新頭殼newtalk,101661,2018-04-27 10:30:04 SGT,Link,2,0,0,0,0,0,0,1,0,,0,0,0,https://www.facebook.com/Newtalk.Page/posts/2017417841620937,檢察總長人事同意權案投票 國民黨團：開放態度,https://newtalk.tw/news/view/2018-04-27/122398,,檢察總長人事同意權案投票 國民黨團：開放態度 | 政治 | 新頭殼 Newtalk,立法院院會今天（27日）針對檢察總長人事同意權案進行投票，國民黨團決議持開放態度，尊重黨籍立委意見。此外，對於是否召集朝野協商商討軍人年改一事，國民黨團遲未得到任何回應，自昨天就搶先排定450案，藉此向院長....,,,3.0
新頭殼newtalk,101657,2018-04-27 07:55:44 SGT,Link,2,0,0,0,1,0,0,0,0,,0,0,0,https://www.facebook.com/Newtalk.Page/posts/2017307494965305,白宮耍心機，搶在文金會前發布,https://newtalk.tw/news/view/2018-04-27/122385,,任命案過關 美新國務卿蓬佩奧亮相合影金正恩 | 國際 | 新頭殼 Newtalk,57對42票，民主黨議員阻止無效，美國參議院在韓國與朝鮮文金會前夕，通過中情局局長蓬佩奧（Mike Pompeo）的國務卿任命案，出身軍旅的蓬佩奧對中國的立場強硬，而白宮也趁機發布蓬佩奧與朝鮮領導人金正恩的在復活節會面合...,,,3.0
新頭殼newtalk,101657,2018-04-26 22:00:04 SGT,Link,1,0,0,0,0,2,0,0,0,,0,0,0,https://www.facebook.com/Newtalk.Page/posts/2016802405015814,邀周錫瑋入競選團隊? 侯友宜:會再訪周前縣長談選舉,https://newtalk.tw/news/view/2018-04-26/122296,,邀周錫瑋入競選團隊? 侯友宜:會再訪周前縣長談選舉 | 政治 | 新頭殼 Newtalk,國民黨新北市長參選人侯友宜昨 (25) 日由新北市長朱立倫陪同拜會前縣長周錫瑋，侯友宜今 (26) 日兩度於受訪時，感謝周錫瑋提供了很多當年他在當縣長的市政經驗，侯友宜表示，與周前縣長面談了一個多小時，氣氛非常融洽，...,,,3.0
新頭殼newtalk,101657,2018-04-26 21:10:05 SGT,Link,3,0,0,0,0,0,0,0,0,,0,0,0,https://www.facebook.com/Newtalk.Page/posts/2016761381686583,手機大廠訂單沒少 瑞儀背光模組勝券在握,https://newtalk.tw/news/view/2018-04-26/122374,,手機大廠訂單沒少 瑞儀背光模組勝券在握 | 財經 | 新頭殼 Newtalk,知名手機大廠背光模組供應商瑞儀光電董事長王本然表示，雖未接獲大客戶今年下半年推出的新液晶面板手機背光模組訂單，但獲追加舊款液晶面板手機背光模組訂單。王本然今天在法人說明會指出，大客戶推出採用主動有機發...,,,3.0
新頭殼newtalk,101657,2018-04-26 19:20:04 SGT,Link,1,1,1,0,0,0,0,0,0,,0,0,0,https://www.facebook.com/Newtalk.Page/posts/2016659951696726,國共論壇可望五月中下旬登場 吳敦義預計近日向府申請,https://newtalk.tw/news/view/2018-04-26/122351,,國共論壇可望五月中下旬登場 吳敦義預計近日向府申請 | 政治 | 新頭殼 Newtalk,由國民黨與共產黨共同舉辦的兩岸論壇可望在五月中下旬登場，今年討論的議題聚焦在台商權益、陸客與陸生質與量等三大面向。黨務人士說，總統府毫無理由阻擋，除非民進黨還想讓兩岸關係持續冰凍，否則應讓國共論壇順利...,,,3.0
新頭殼newtalk,101657,2018-04-26 17:40:03 SGT,Link,2,1,0,0,0,0,0,0,0,,0,0,0,https://www.facebook.com/Newtalk.Page/posts/2016586155037439,環團批深澳污染重 台電： 重金屬排放非常低　,https://newtalk.tw/news/view/2018-04-26/122334,,環團批深澳污染重 台電： 重金屬排放非常低　 | 環保 | 新頭殼 Newtalk,深澳電廠議題不斷延燒，針對今(26)日環保團體關注台電新深澳電廠超超臨界計畫，質疑用「世界一流」文字粉飾燃煤電廠污染事實，台電表示，日本磯子電廠是國際能源署(IEA)公認世界第一的高效率低排放燃煤電廠，使用相同的...,,,3.0
新頭殼newtalk,101657,2018-04-26 10:40:03 SGT,Link,2,0,0,0,0,1,0,0,0,,0,0,0,https://www.facebook.com/Newtalk.Page/posts/2016294265066628,賓拉登前保鏕爆藏德國領福利津貼 天天警局報到,https://newtalk.tw/news/view/2018-04-26/122267,,賓拉登前保鏕爆藏德國領福利津貼 天天警局報到 | 國際 | 新頭殼 Newtalk,賓恐怖蓋達組織創始人、同時是2001年美國911事件主使賓拉登（Osama bin Laden）的1名突尼西亞前保鏕，被爆居住在德國波鴻市（Bochum），月領1168歐元福利津貼，雖然沒有通過德國的庇護申請，但為了他的安全，德國也不打算遣返他...,,,3.0
